Frame 20: 80 bytes on wire (640 bits), 80 bytes captured (640 bits)
    Encapsulation type: Linux cooked-mode capture v2 (210)
    Arrival Time: Nov  8, 2025 04:34:49.496274000 EST
    UTC Arrival Time: Nov  8, 2025 09:34:49.496274000 UTC
    Epoch Arrival Time: 1762594489.496274000
    [Time shift for this packet: 0.000000000 seconds]
    [Time delta from previous captured frame: 65.845506000 seconds]
    [Time delta from previous displayed frame: 0.000000000 seconds]
    [Time since reference or first frame: 100.034395000 seconds]
    Frame Number: 20
    Frame Length: 80 bytes (640 bits)
    Capture Length: 80 bytes (640 bits)
    [Frame is marked: False]
    [Frame is ignored: False]
    [Protocols in frame: sll:ethertype:ip:tcp]
Linux cooked capture v2
    Protocol: IPv4 (0x0800)
    Interface index: 2
    Link-layer address type: Ethernet (1)
    Packet type: Sent by us (4)
    Link-layer address length: 6
    Source: VMware_c6:e4:29 (00:0c:29:c6:e4:29)
    Unused: 0000
Internet Protocol Version 4, Src: 192.168.181.128, Dst: 220.181.174.33
    0100 .... = Version: 4
    .... 0101 = Header Length: 20 bytes (5)
    Differentiated Services Field: 0x00 (DSCP: CS0, ECN: Not-ECT)
        0000 00.. = Differentiated Services Codepoint: Default (0)
        .... ..00 = Explicit Congestion Notification: Not ECN-Capable Transport (0)
    Total Length: 60
    Identification: 0x64a3 (25763)
    010. .... = Flags: 0x2, Don't fragment
        0... .... = Reserved bit: Not set
        .1.. .... = Don't fragment: Set
        ..0. .... = More fragments: Not set
    ...0 0000 0000 0000 = Fragment Offset: 0
    Time to Live: 64
    Protocol: TCP (6)
    Header Checksum: 0xd518 [validation disabled]
    [Header checksum status: Unverified]
    Source Address: 192.168.181.128
    Destination Address: 220.181.174.33
    [Stream index: 2]
Transmission Control Protocol, Src Port: 33914, Dst Port: 443, Seq: 0, Len: 0
    Source Port: 33914
    Destination Port: 443
    [Stream index: 2]
    [Stream Packet Number: 1]
    [Conversation completeness: Incomplete (0)]
        ..0. .... = RST: Absent
        ...0 .... = FIN: Absent
        .... 0... = Data: Absent
        .... .0.. = ACK: Absent
        .... ..0. = SYN-ACK: Absent
        .... ...0 = SYN: Absent
        [Completeness Flags: [ Null ]]
    [TCP Segment Len: 0]
    Sequence Number: 0    (relative sequence number)
    Sequence Number (raw): 2757991994
    [Next Sequence Number: 1    (relative sequence number)]
    Acknowledgment Number: 0
    Acknowledgment number (raw): 0
    1010 .... = Header Length: 40 bytes (10)
    Flags: 0x002 (SYN)
        000. .... .... = Reserved: Not set
        ...0 .... .... = Accurate ECN: Not set
        .... 0... .... = Congestion Window Reduced: Not set
        .... .0.. .... = ECN-Echo: Not set
        .... ..0. .... = Urgent: Not set
        .... ...0 .... = Acknowledgment: Not set
        .... .... 0... = Push: Not set
        .... .... .0.. = Reset: Not set
        .... .... ..1. = Syn: Set
            [Expert Info (Chat/Sequence): Connection establish request (SYN): server port 443]
                [Connection establish request (SYN): server port 443]
                [Severity level: Chat]
                [Group: Sequence]
        .... .... ...0 = Fin: Not set
        [TCP Flags: ··········S·]
    Window: 64240
    [Calculated window size: 64240]
    Checksum: 0x012f [unverified]
    [Checksum Status: Unverified]
    Urgent Pointer: 0
    Options: (20 bytes), Maximum segment size, SACK permitted, Timestamps, No-Operation (NOP), Window scale
        TCP Option - Maximum segment size: 1460 bytes
            Kind: Maximum Segment Size (2)
            Length: 4
            MSS Value: 1460
        TCP Option - SACK permitted
            Kind: SACK Permitted (4)
            Length: 2
        TCP Option - Timestamps: TSval 2263464873, TSecr 0
            Kind: Time Stamp Option (8)
            Length: 10
            Timestamp value: 2263464873
            Timestamp echo reply: 0
        TCP Option - No-Operation (NOP)
            Kind: No-Operation (1)
        TCP Option - Window scale: 7 (multiply by 128)
            Kind: Window Scale (3)
            Length: 3
            Shift count: 7
            [Multiplier: 128]
    [Timestamps]
        [Time since first frame in this TCP stream: 0.000000000 seconds]
        [Time since previous frame in this TCP stream: 0.000000000 seconds]

Frame 21: 66 bytes on wire (528 bits), 66 bytes captured (528 bits)
    Encapsulation type: Linux cooked-mode capture v2 (210)
    Arrival Time: Nov  8, 2025 04:34:49.533418000 EST
    UTC Arrival Time: Nov  8, 2025 09:34:49.533418000 UTC
    Epoch Arrival Time: 1762594489.533418000
    [Time shift for this packet: 0.000000000 seconds]
    [Time delta from previous captured frame: 0.037144000 seconds]
    [Time delta from previous displayed frame: 0.037144000 seconds]
    [Time since reference or first frame: 100.071539000 seconds]
    Frame Number: 21
    Frame Length: 66 bytes (528 bits)
    Capture Length: 66 bytes (528 bits)
    [Frame is marked: False]
    [Frame is ignored: False]
    [Protocols in frame: sll:ethertype:ip:tcp]
Linux cooked capture v2
    Protocol: IPv4 (0x0800)
    Interface index: 2
    Link-layer address type: Ethernet (1)
    Packet type: Unicast to us (0)
    Link-layer address length: 6
    Source: VMware_f2:91:22 (00:50:56:f2:91:22)
    Unused: 0000
    Padding: 0000
Internet Protocol Version 4, Src: 220.181.174.33, Dst: 192.168.181.128
    0100 .... = Version: 4
    .... 0101 = Header Length: 20 bytes (5)
    Differentiated Services Field: 0x00 (DSCP: CS0, ECN: Not-ECT)
        0000 00.. = Differentiated Services Codepoint: Default (0)
        .... ..00 = Explicit Congestion Notification: Not ECN-Capable Transport (0)
    Total Length: 44
    Identification: 0x003a (58)
    000. .... = Flags: 0x0
        0... .... = Reserved bit: Not set
        .0.. .... = Don't fragment: Not set
        ..0. .... = More fragments: Not set
    ...0 0000 0000 0000 = Fragment Offset: 0
    Time to Live: 128
    Protocol: TCP (6)
    Header Checksum: 0x3992 [validation disabled]
    [Header checksum status: Unverified]
    Source Address: 220.181.174.33
    Destination Address: 192.168.181.128
    [Stream index: 2]
Transmission Control Protocol, Src Port: 443, Dst Port: 33914, Seq: 0, Ack: 1, Len: 0
    Source Port: 443
    Destination Port: 33914
    [Stream index: 2]
    [Stream Packet Number: 2]
    [Conversation completeness: Incomplete, SYN_SENT (1)]
        ..0. .... = RST: Absent
        ...0 .... = FIN: Absent
        .... 0... = Data: Absent
        .... .0.. = ACK: Absent
        .... ..0. = SYN-ACK: Absent
        .... ...1 = SYN: Present
        [Completeness Flags: ·····S]
    [TCP Segment Len: 0]
    Sequence Number: 0    (relative sequence number)
    Sequence Number (raw): 1356947680
    [Next Sequence Number: 1    (relative sequence number)]
    Acknowledgment Number: 1    (relative ack number)
    Acknowledgment number (raw): 2757991995
    0110 .... = Header Length: 24 bytes (6)
    Flags: 0x012 (SYN, ACK)
        000. .... .... = Reserved: Not set
        ...0 .... .... = Accurate ECN: Not set
        .... 0... .... = Congestion Window Reduced: Not set
        .... .0.. .... = ECN-Echo: Not set
        .... ..0. .... = Urgent: Not set
        .... ...1 .... = Acknowledgment: Set
        .... .... 0... = Push: Not set
        .... .... .0.. = Reset: Not set
        .... .... ..1. = Syn: Set
            [Expert Info (Chat/Sequence): Connection establish acknowledge (SYN+ACK): server port 443]
                [Connection establish acknowledge (SYN+ACK): server port 443]
                [Severity level: Chat]
                [Group: Sequence]
        .... .... ...0 = Fin: Not set
        [TCP Flags: ·······A··S·]
    Window: 64240
    [Calculated window size: 64240]
    Checksum: 0x218f [unverified]
    [Checksum Status: Unverified]
    Urgent Pointer: 0
    Options: (4 bytes), Maximum segment size
        TCP Option - Maximum segment size: 1460 bytes
            Kind: Maximum Segment Size (2)
            Length: 4
            MSS Value: 1460
        [Expert Info (Note/Protocol): The SYN packet does not contain a SACK PERM option]
            [The SYN packet does not contain a SACK PERM option]
            [Severity level: Note]
            [Group: Protocol]
    [Timestamps]
        [Time since first frame in this TCP stream: 0.037144000 seconds]
        [Time since previous frame in this TCP stream: 0.037144000 seconds]
    [SEQ/ACK analysis]
        [This is an ACK to the segment in frame: 20]
        [The RTT to ACK the segment was: 0.037144000 seconds]

Frame 22: 60 bytes on wire (480 bits), 60 bytes captured (480 bits)
    Encapsulation type: Linux cooked-mode capture v2 (210)
    Arrival Time: Nov  8, 2025 04:34:49.533461000 EST
    UTC Arrival Time: Nov  8, 2025 09:34:49.533461000 UTC
    Epoch Arrival Time: 1762594489.533461000
    [Time shift for this packet: 0.000000000 seconds]
    [Time delta from previous captured frame: 0.000043000 seconds]
    [Time delta from previous displayed frame: 0.000043000 seconds]
    [Time since reference or first frame: 100.071582000 seconds]
    Frame Number: 22
    Frame Length: 60 bytes (480 bits)
    Capture Length: 60 bytes (480 bits)
    [Frame is marked: False]
    [Frame is ignored: False]
    [Protocols in frame: sll:ethertype:ip:tcp]
Linux cooked capture v2
    Protocol: IPv4 (0x0800)
    Interface index: 2
    Link-layer address type: Ethernet (1)
    Packet type: Sent by us (4)
    Link-layer address length: 6
    Source: VMware_c6:e4:29 (00:0c:29:c6:e4:29)
    Unused: 0000
Internet Protocol Version 4, Src: 192.168.181.128, Dst: 220.181.174.33
    0100 .... = Version: 4
    .... 0101 = Header Length: 20 bytes (5)
    Differentiated Services Field: 0x00 (DSCP: CS0, ECN: Not-ECT)
        0000 00.. = Differentiated Services Codepoint: Default (0)
        .... ..00 = Explicit Congestion Notification: Not ECN-Capable Transport (0)
    Total Length: 40
    Identification: 0x64a4 (25764)
    010. .... = Flags: 0x2, Don't fragment
        0... .... = Reserved bit: Not set
        .1.. .... = Don't fragment: Set
        ..0. .... = More fragments: Not set
    ...0 0000 0000 0000 = Fragment Offset: 0
    Time to Live: 64
    Protocol: TCP (6)
    Header Checksum: 0xd52b [validation disabled]
    [Header checksum status: Unverified]
    Source Address: 192.168.181.128
    Destination Address: 220.181.174.33
    [Stream index: 2]
Transmission Control Protocol, Src Port: 33914, Dst Port: 443, Seq: 1, Ack: 1, Len: 0
    Source Port: 33914
    Destination Port: 443
    [Stream index: 2]
    [Stream Packet Number: 3]
    [Conversation completeness: Incomplete, CLIENT_ESTABLISHED (3)]
        ..0. .... = RST: Absent
        ...0 .... = FIN: Absent
        .... 0... = Data: Absent
        .... .0.. = ACK: Absent
        .... ..1. = SYN-ACK: Present
        .... ...1 = SYN: Present
        [Completeness Flags: ····SS]
    [TCP Segment Len: 0]
    Sequence Number: 1    (relative sequence number)
    Sequence Number (raw): 2757991995
    [Next Sequence Number: 1    (relative sequence number)]
    Acknowledgment Number: 1    (relative ack number)
    Acknowledgment number (raw): 1356947681
    0101 .... = Header Length: 20 bytes (5)
    Flags: 0x010 (ACK)
        000. .... .... = Reserved: Not set
        ...0 .... .... = Accurate ECN: Not set
        .... 0... .... = Congestion Window Reduced: Not set
        .... .0.. .... = ECN-Echo: Not set
        .... ..0. .... = Urgent: Not set
        .... ...1 .... = Acknowledgment: Set
        .... .... 0... = Push: Not set
        .... .... .0.. = Reset: Not set
        .... .... ..0. = Syn: Not set
        .... .... ...0 = Fin: Not set
        [TCP Flags: ·······A····]
    Window: 64240
    [Calculated window size: 64240]
    [Window size scaling factor: -2 (no window scaling used)]
    Checksum: 0x011b [unverified]
    [Checksum Status: Unverified]
    Urgent Pointer: 0
    [Timestamps]
        [Time since first frame in this TCP stream: 0.037187000 seconds]
        [Time since previous frame in this TCP stream: 0.000043000 seconds]
    [SEQ/ACK analysis]
        [This is an ACK to the segment in frame: 21]
        [The RTT to ACK the segment was: 0.000043000 seconds]
        [iRTT: 0.037187000 seconds]

Frame 23: 1305 bytes on wire (10440 bits), 1305 bytes captured (10440 bits)
    Encapsulation type: Linux cooked-mode capture v2 (210)
    Arrival Time: Nov  8, 2025 04:34:49.534509000 EST
    UTC Arrival Time: Nov  8, 2025 09:34:49.534509000 UTC
    Epoch Arrival Time: 1762594489.534509000
    [Time shift for this packet: 0.000000000 seconds]
    [Time delta from previous captured frame: 0.001048000 seconds]
    [Time delta from previous displayed frame: 0.001048000 seconds]
    [Time since reference or first frame: 100.072630000 seconds]
    Frame Number: 23
    Frame Length: 1305 bytes (10440 bits)
    Capture Length: 1305 bytes (10440 bits)
    [Frame is marked: False]
    [Frame is ignored: False]
    [Protocols in frame: sll:ethertype:ip:tcp:tls]
Linux cooked capture v2
    Protocol: IPv4 (0x0800)
    Interface index: 2
    Link-layer address type: Ethernet (1)
    Packet type: Sent by us (4)
    Link-layer address length: 6
    Source: VMware_c6:e4:29 (00:0c:29:c6:e4:29)
    Unused: 0000
Internet Protocol Version 4, Src: 192.168.181.128, Dst: 220.181.174.33
    0100 .... = Version: 4
    .... 0101 = Header Length: 20 bytes (5)
    Differentiated Services Field: 0x00 (DSCP: CS0, ECN: Not-ECT)
        0000 00.. = Differentiated Services Codepoint: Default (0)
        .... ..00 = Explicit Congestion Notification: Not ECN-Capable Transport (0)
    Total Length: 1285
    Identification: 0x64a5 (25765)
    010. .... = Flags: 0x2, Don't fragment
        0... .... = Reserved bit: Not set
        .1.. .... = Don't fragment: Set
        ..0. .... = More fragments: Not set
    ...0 0000 0000 0000 = Fragment Offset: 0
    Time to Live: 64
    Protocol: TCP (6)
    Header Checksum: 0xd04d [validation disabled]
    [Header checksum status: Unverified]
    Source Address: 192.168.181.128
    Destination Address: 220.181.174.33
    [Stream index: 2]
Transmission Control Protocol, Src Port: 33914, Dst Port: 443, Seq: 1, Ack: 1, Len: 1245
    Source Port: 33914
    Destination Port: 443
    [Stream index: 2]
    [Stream Packet Number: 4]
    [Conversation completeness: Incomplete, ESTABLISHED (7)]
        ..0. .... = RST: Absent
        ...0 .... = FIN: Absent
        .... 0... = Data: Absent
        .... .1.. = ACK: Present
        .... ..1. = SYN-ACK: Present
        .... ...1 = SYN: Present
        [Completeness Flags: ···ASS]
    [TCP Segment Len: 1245]
    Sequence Number: 1    (relative sequence number)
    Sequence Number (raw): 2757991995
    [Next Sequence Number: 1246    (relative sequence number)]
    Acknowledgment Number: 1    (relative ack number)
    Acknowledgment number (raw): 1356947681
    0101 .... = Header Length: 20 bytes (5)
    Flags: 0x018 (PSH, ACK)
        000. .... .... = Reserved: Not set
        ...0 .... .... = Accurate ECN: Not set
        .... 0... .... = Congestion Window Reduced: Not set
        .... .0.. .... = ECN-Echo: Not set
        .... ..0. .... = Urgent: Not set
        .... ...1 .... = Acknowledgment: Set
        .... .... 1... = Push: Set
        .... .... .0.. = Reset: Not set
        .... .... ..0. = Syn: Not set
        .... .... ...0 = Fin: Not set
        [TCP Flags: ·······AP···]
    Window: 64240
    [Calculated window size: 64240]
    [Window size scaling factor: -2 (no window scaling used)]
    Checksum: 0x05f8 [unverified]
    [Checksum Status: Unverified]
    Urgent Pointer: 0
    [Timestamps]
        [Time since first frame in this TCP stream: 0.038235000 seconds]
        [Time since previous frame in this TCP stream: 0.001048000 seconds]
    [SEQ/ACK analysis]
        [iRTT: 0.037187000 seconds]
        [Bytes in flight: 1245]
        [Bytes sent since last PSH flag: 1245]
    TCP payload (1245 bytes)
Transport Layer Security
    TLSv1 Record Layer: Handshake Protocol: Client Hello
        Content Type: Handshake (22)
        Version: TLS 1.0 (0x0301)
        Length: 1240
        Handshake Protocol: Client Hello
            Handshake Type: Client Hello (1)
            Length: 1236
            Version: TLS 1.2 (0x0303)
                [Expert Info (Chat/Deprecated): This legacy_version field MUST be ignored. The supported_versions extension is present and MUST be used instead.]
                    [This legacy_version field MUST be ignored. The supported_versions extension is present and MUST be used instead.]
                    [Severity level: Chat]
                    [Group: Deprecated]
            Random: 3ca824dc6211d35ecf8c3931d6c261d8703c6ae960e3a589251db149424df167
                GMT Unix Time: Apr  1, 2002 04:14:04.000000000 EST
                Random Bytes: 6211d35ecf8c3931d6c261d8703c6ae960e3a589251db149424df167
            Session ID Length: 32
            Session ID: 963e623ea0b184e2b13d76a77d3fa078e8248e77d7ba5fe80d2adb2466b3a40b
            Cipher Suites Length: 34
            Cipher Suites (17 suites)
                Cipher Suite: TLS_AES_128_GCM_SHA256 (0x1301)
                Cipher Suite: TLS_CHACHA20_POLY1305_SHA256 (0x1303)
                Cipher Suite: TLS_AES_256_GCM_SHA384 (0x1302)
                Cipher Suite: TLS_ECDHE_ECDSA_WITH_AES_128_GCM_SHA256 (0xc02b)
                Cipher Suite: TLS_ECDHE_RSA_WITH_AES_128_GCM_SHA256 (0xc02f)
                Cipher Suite: TLS_ECDHE_ECDSA_WITH_CHACHA20_POLY1305_SHA256 (0xcca9)
                Cipher Suite: TLS_ECDHE_RSA_WITH_CHACHA20_POLY1305_SHA256 (0xcca8)
                Cipher Suite: TLS_ECDHE_ECDSA_WITH_AES_256_GCM_SHA384 (0xc02c)
                Cipher Suite: TLS_ECDHE_RSA_WITH_AES_256_GCM_SHA384 (0xc030)
                Cipher Suite: TLS_ECDHE_ECDSA_WITH_AES_256_CBC_SHA (0xc00a)
                Cipher Suite: TLS_ECDHE_ECDSA_WITH_AES_128_CBC_SHA (0xc009)
                Cipher Suite: TLS_ECDHE_RSA_WITH_AES_128_CBC_SHA (0xc013)
                Cipher Suite: TLS_ECDHE_RSA_WITH_AES_256_CBC_SHA (0xc014)
                Cipher Suite: TLS_RSA_WITH_AES_128_GCM_SHA256 (0x009c)
                Cipher Suite: TLS_RSA_WITH_AES_256_GCM_SHA384 (0x009d)
                Cipher Suite: TLS_RSA_WITH_AES_128_CBC_SHA (0x002f)
                Cipher Suite: TLS_RSA_WITH_AES_256_CBC_SHA (0x0035)
            Compression Methods Length: 1
            Compression Methods (1 method)
                Compression Method: null (0)
            Extensions Length: 1129
            Extension: server_name (len=32) name=safebrowsing.googleapis.com
                Type: server_name (0)
                Length: 32
                Server Name Indication extension
                    Server Name list length: 30
                    Server Name Type: host_name (0)
                    Server Name length: 27
                    Server Name: safebrowsing.googleapis.com
            Extension: extended_master_secret (len=0)
                Type: extended_master_secret (23)
                Length: 0
            Extension: renegotiation_info (len=1)
                Type: renegotiation_info (65281)
                Length: 1
                Renegotiation Info extension
                    Renegotiation info extension length: 0
            Extension: supported_groups (len=14)
                Type: supported_groups (10)
                Length: 14
                Supported Groups List Length: 12
                Supported Groups (6 groups)
                    Supported Group: x25519 (0x001d)
                    Supported Group: secp256r1 (0x0017)
                    Supported Group: secp384r1 (0x0018)
                    Supported Group: secp521r1 (0x0019)
                    Supported Group: ffdhe2048 (0x0100)
                    Supported Group: ffdhe3072 (0x0101)
            Extension: ec_point_formats (len=2)
                Type: ec_point_formats (11)
                Length: 2
                EC point formats Length: 1
                Elliptic curves point formats (1)
                    EC point format: uncompressed (0)
            Extension: application_layer_protocol_negotiation (len=14)
                Type: application_layer_protocol_negotiation (16)
                Length: 14
                ALPN Extension Length: 12
                ALPN Protocol
                    ALPN string length: 2
                    ALPN Next Protocol: h2
                    ALPN string length: 8
                    ALPN Next Protocol: http/1.1
            Extension: status_request (len=5)
                Type: status_request (5)
                Length: 5
                Certificate Status Type: OCSP (1)
                Responder ID list Length: 0
                Request Extensions Length: 0
            Extension: delegated_credentials (len=10)
                Type: delegated_credentials (34)
                Length: 10
                Signature Hash Algorithms Length: 8
                Signature Hash Algorithms (4 algorithms)
                    Signature Algorithm: ecdsa_secp256r1_sha256 (0x0403)
                        Signature Hash Algorithm Hash: SHA256 (4)
                        Signature Hash Algorithm Signature: ECDSA (3)
                    Signature Algorithm: ecdsa_secp384r1_sha384 (0x0503)
                        Signature Hash Algorithm Hash: SHA384 (5)
                        Signature Hash Algorithm Signature: ECDSA (3)
                    Signature Algorithm: ecdsa_secp521r1_sha512 (0x0603)
                        Signature Hash Algorithm Hash: SHA512 (6)
                        Signature Hash Algorithm Signature: ECDSA (3)
                    Signature Algorithm: ecdsa_sha1 (0x0203)
                        Signature Hash Algorithm Hash: SHA1 (2)
                        Signature Hash Algorithm Signature: ECDSA (3)
            Extension: key_share (len=107) x25519, secp256r1
                Type: key_share (51)
                Length: 107
                Key Share extension
                    Client Key Share Length: 105
                    Key Share Entry: Group: x25519, Key Exchange length: 32
                        Group: x25519 (29)
                        Key Exchange Length: 32
                        Key Exchange: 45c5814d620e0af049f16213dac4db577210c215244cadec740e67a5a3445816
                    Key Share Entry: Group: secp256r1, Key Exchange length: 65
                        Group: secp256r1 (23)
                        Key Exchange Length: 65
                        Key Exchange: 04108c53a6aa503434def583cb4148e8d643dd4ee2e0e0d879e3224ce2a55ce22e5687ae7a4ec08d3d912a90f14af5e6d622455cf4f657550542f0efaca17218f5
            Extension: early_data (len=0)
                Type: early_data (42)
                Length: 0
            Extension: supported_versions (len=5) TLS 1.3, TLS 1.2
                Type: supported_versions (43)
                Length: 5
                Supported Versions length: 4
                Supported Version: TLS 1.3 (0x0304)
                Supported Version: TLS 1.2 (0x0303)
            Extension: signature_algorithms (len=24)
                Type: signature_algorithms (13)
                Length: 24
                Signature Hash Algorithms Length: 22
                Signature Hash Algorithms (11 algorithms)
                    Signature Algorithm: ecdsa_secp256r1_sha256 (0x0403)
                        Signature Hash Algorithm Hash: SHA256 (4)
                        Signature Hash Algorithm Signature: ECDSA (3)
                    Signature Algorithm: ecdsa_secp384r1_sha384 (0x0503)
                        Signature Hash Algorithm Hash: SHA384 (5)
                        Signature Hash Algorithm Signature: ECDSA (3)
                    Signature Algorithm: ecdsa_secp521r1_sha512 (0x0603)
                        Signature Hash Algorithm Hash: SHA512 (6)
                        Signature Hash Algorithm Signature: ECDSA (3)
                    Signature Algorithm: rsa_pss_rsae_sha256 (0x0804)
                        Signature Hash Algorithm Hash: Unknown (8)
                        Signature Hash Algorithm Signature: Unknown (4)
                    Signature Algorithm: rsa_pss_rsae_sha384 (0x0805)
                        Signature Hash Algorithm Hash: Unknown (8)
                        Signature Hash Algorithm Signature: Unknown (5)
                    Signature Algorithm: rsa_pss_rsae_sha512 (0x0806)
                        Signature Hash Algorithm Hash: Unknown (8)
                        Signature Hash Algorithm Signature: Unknown (6)
                    Signature Algorithm: rsa_pkcs1_sha256 (0x0401)
                        Signature Hash Algorithm Hash: SHA256 (4)
                        Signature Hash Algorithm Signature: RSA (1)
                    Signature Algorithm: rsa_pkcs1_sha384 (0x0501)
                        Signature Hash Algorithm Hash: SHA384 (5)
                        Signature Hash Algorithm Signature: RSA (1)
                    Signature Algorithm: rsa_pkcs1_sha512 (0x0601)
                        Signature Hash Algorithm Hash: SHA512 (6)
                        Signature Hash Algorithm Signature: RSA (1)
                    Signature Algorithm: ecdsa_sha1 (0x0203)
                        Signature Hash Algorithm Hash: SHA1 (2)
                        Signature Hash Algorithm Signature: ECDSA (3)
                    Signature Algorithm: rsa_pkcs1_sha1 (0x0201)
                        Signature Hash Algorithm Hash: SHA1 (2)
                        Signature Hash Algorithm Signature: RSA (1)
            Extension: psk_key_exchange_modes (len=2)
                Type: psk_key_exchange_modes (45)
                Length: 2
                PSK Key Exchange Modes Length: 1
                PSK Key Exchange Mode: PSK with (EC)DHE key establishment (psk_dhe_ke) (1)
            Extension: record_size_limit (len=2)
                Type: record_size_limit (28)
                Length: 2
                Record Size Limit: 16385
            Extension: encrypted_client_hello (len=569)
                Type: encrypted_client_hello (65037)
                Length: 569
                Client Hello type: Outer Client Hello (0)
                Cipher Suite: HKDF-SHA256/ChaCha20Poly1305
                    KDF Id: HKDF-SHA256 (1)
                    AEAD Id: ChaCha20Poly1305 (3)
                Config Id: 166
                Enc length: 32
                Enc: 78df4e7f4029cff336bb3bcdd24fb9239c50d9c7a02f41097ac75ca932688a17
                Payload length: 527
                Payload […]: baf96e059954e9bce3445f27bec3818158718f14c3207c90c8016d7a7ebe186fd71e311830e46637774a0837c540657a0ce8f82451f37d8a4899e00f591dcb2a88860d826ad9d6a94afc6fa9b295a15c269409eaaa4a41564f6b9cc9daa7556e166e6fd746cf9ca4f6dac5da854c6b7a
            Extension: pre_shared_key (len=278)
                Type: pre_shared_key (41)
                Length: 278
                Pre-Shared Key extension
                    Identities Length: 241
                    PSK Identity (length: 235)
                        Identity Length: 235
                        Identity […]: 0207d820d9d19afad3a62437a146cfaa1cf95349f19aef912b5ff455b94786d37128cd1d843fea2c088d896758ee5c7ca0fef7e286da3bf48ce0fe24b7f3829036eccc8af3ccb0885ce44c6712c724d14c2631bc05447d5f208ec8c955600684699fef6bbb625fcbbbb223f1537fcf2
                        Obfuscated Ticket Age: 4183951685
                    PSK Binders length: 33
                    PSK Binders
            [JA4: t13d1716h2_5b57614c22b0_28a30a3f7180]
            [JA4_r: t13d1716h2_002f,0035,009c,009d,1301,1302,1303,c009,c00a,c013,c014,c02b,c02c,c02f,c030,cca8,cca9_0005,000a,000b,000d,0017,001c,0022,0029,002a,002b,002d,0033,fe0d,ff01_0403,0503,0603,0804,0805,0806,0401,0501,0601,0203,0201]
            [JA3 Fullstring: 771,4865-4867-4866-49195-49199-52393-52392-49196-49200-49162-49161-49171-49172-156-157-47-53,0-23-65281-10-11-16-5-34-51-42-43-13-45-28-65037-41,29-23-24-25-256-257,0]
            [JA3: a696a018266f1e7e33d73ecf3b64f8fd]

Frame 24: 66 bytes on wire (528 bits), 66 bytes captured (528 bits)
    Encapsulation type: Linux cooked-mode capture v2 (210)
    Arrival Time: Nov  8, 2025 04:34:49.534708000 EST
    UTC Arrival Time: Nov  8, 2025 09:34:49.534708000 UTC
    Epoch Arrival Time: 1762594489.534708000
    [Time shift for this packet: 0.000000000 seconds]
    [Time delta from previous captured frame: 0.000199000 seconds]
    [Time delta from previous displayed frame: 0.000199000 seconds]
    [Time since reference or first frame: 100.072829000 seconds]
    Frame Number: 24
    Frame Length: 66 bytes (528 bits)
    Capture Length: 66 bytes (528 bits)
    [Frame is marked: False]
    [Frame is ignored: False]
    [Protocols in frame: sll:ethertype:ip:tcp]
Linux cooked capture v2
    Protocol: IPv4 (0x0800)
    Interface index: 2
    Link-layer address type: Ethernet (1)
    Packet type: Unicast to us (0)
    Link-layer address length: 6
    Source: VMware_f2:91:22 (00:50:56:f2:91:22)
    Unused: 0000
    Padding: 000000000000
Internet Protocol Version 4, Src: 220.181.174.33, Dst: 192.168.181.128
    0100 .... = Version: 4
    .... 0101 = Header Length: 20 bytes (5)
    Differentiated Services Field: 0x00 (DSCP: CS0, ECN: Not-ECT)
        0000 00.. = Differentiated Services Codepoint: Default (0)
        .... ..00 = Explicit Congestion Notification: Not ECN-Capable Transport (0)
    Total Length: 40
    Identification: 0x003b (59)
    000. .... = Flags: 0x0
        0... .... = Reserved bit: Not set
        .0.. .... = Don't fragment: Not set
        ..0. .... = More fragments: Not set
    ...0 0000 0000 0000 = Fragment Offset: 0
    Time to Live: 128
    Protocol: TCP (6)
    Header Checksum: 0x3995 [validation disabled]
    [Header checksum status: Unverified]
    Source Address: 220.181.174.33
    Destination Address: 192.168.181.128
    [Stream index: 2]
Transmission Control Protocol, Src Port: 443, Dst Port: 33914, Seq: 1, Ack: 1246, Len: 0
    Source Port: 443
    Destination Port: 33914
    [Stream index: 2]
    [Stream Packet Number: 5]
    [Conversation completeness: Incomplete, DATA (15)]
        ..0. .... = RST: Absent
        ...0 .... = FIN: Absent
        .... 1... = Data: Present
        .... .1.. = ACK: Present
        .... ..1. = SYN-ACK: Present
        .... ...1 = SYN: Present
        [Completeness Flags: ··DASS]
    [TCP Segment Len: 0]
    Sequence Number: 1    (relative sequence number)
    Sequence Number (raw): 1356947681
    [Next Sequence Number: 1    (relative sequence number)]
    Acknowledgment Number: 1246    (relative ack number)
    Acknowledgment number (raw): 2757993240
    0101 .... = Header Length: 20 bytes (5)
    Flags: 0x010 (ACK)
        000. .... .... = Reserved: Not set
        ...0 .... .... = Accurate ECN: Not set
        .... 0... .... = Congestion Window Reduced: Not set
        .... .0.. .... = ECN-Echo: Not set
        .... ..0. .... = Urgent: Not set
        .... ...1 .... = Acknowledgment: Set
        .... .... 0... = Push: Not set
        .... .... .0.. = Reset: Not set
        .... .... ..0. = Syn: Not set
        .... .... ...0 = Fin: Not set
        [TCP Flags: ·······A····]
    Window: 64240
    [Calculated window size: 64240]
    [Window size scaling factor: -2 (no window scaling used)]
    Checksum: 0x346f [unverified]
    [Checksum Status: Unverified]
    Urgent Pointer: 0
    [Timestamps]
        [Time since first frame in this TCP stream: 0.038434000 seconds]
        [Time since previous frame in this TCP stream: 0.000199000 seconds]
    [SEQ/ACK analysis]
        [This is an ACK to the segment in frame: 23]
        [The RTT to ACK the segment was: 0.000199000 seconds]
        [iRTT: 0.037187000 seconds]

Frame 25: 66 bytes on wire (528 bits), 66 bytes captured (528 bits)
    Encapsulation type: Linux cooked-mode capture v2 (210)
    Arrival Time: Nov  8, 2025 04:34:49.534826000 EST
    UTC Arrival Time: Nov  8, 2025 09:34:49.534826000 UTC
    Epoch Arrival Time: 1762594489.534826000
    [Time shift for this packet: 0.000000000 seconds]
    [Time delta from previous captured frame: 0.000118000 seconds]
    [Time delta from previous displayed frame: 0.000118000 seconds]
    [Time since reference or first frame: 100.072947000 seconds]
    Frame Number: 25
    Frame Length: 66 bytes (528 bits)
    Capture Length: 66 bytes (528 bits)
    [Frame is marked: False]
    [Frame is ignored: False]
    [Protocols in frame: sll:ethertype:ip:tcp:tls]
Linux cooked capture v2
    Protocol: IPv4 (0x0800)
    Interface index: 2
    Link-layer address type: Ethernet (1)
    Packet type: Sent by us (4)
    Link-layer address length: 6
    Source: VMware_c6:e4:29 (00:0c:29:c6:e4:29)
    Unused: 0000
Internet Protocol Version 4, Src: 192.168.181.128, Dst: 220.181.174.33
    0100 .... = Version: 4
    .... 0101 = Header Length: 20 bytes (5)
    Differentiated Services Field: 0x00 (DSCP: CS0, ECN: Not-ECT)
        0000 00.. = Differentiated Services Codepoint: Default (0)
        .... ..00 = Explicit Congestion Notification: Not ECN-Capable Transport (0)
    Total Length: 46
    Identification: 0x64a6 (25766)
    010. .... = Flags: 0x2, Don't fragment
        0... .... = Reserved bit: Not set
        .1.. .... = Don't fragment: Set
        ..0. .... = More fragments: Not set
    ...0 0000 0000 0000 = Fragment Offset: 0
    Time to Live: 64
    Protocol: TCP (6)
    Header Checksum: 0xd523 [validation disabled]
    [Header checksum status: Unverified]
    Source Address: 192.168.181.128
    Destination Address: 220.181.174.33
    [Stream index: 2]
Transmission Control Protocol, Src Port: 33914, Dst Port: 443, Seq: 1246, Ack: 1, Len: 6
    Source Port: 33914
    Destination Port: 443
    [Stream index: 2]
    [Stream Packet Number: 6]
    [Conversation completeness: Incomplete, DATA (15)]
        ..0. .... = RST: Absent
        ...0 .... = FIN: Absent
        .... 1... = Data: Present
        .... .1.. = ACK: Present
        .... ..1. = SYN-ACK: Present
        .... ...1 = SYN: Present
        [Completeness Flags: ··DASS]
    [TCP Segment Len: 6]
    Sequence Number: 1246    (relative sequence number)
    Sequence Number (raw): 2757993240
    [Next Sequence Number: 1252    (relative sequence number)]
    Acknowledgment Number: 1    (relative ack number)
    Acknowledgment number (raw): 1356947681
    0101 .... = Header Length: 20 bytes (5)
    Flags: 0x018 (PSH, ACK)
        000. .... .... = Reserved: Not set
        ...0 .... .... = Accurate ECN: Not set
        .... 0... .... = Congestion Window Reduced: Not set
        .... .0.. .... = ECN-Echo: Not set
        .... ..0. .... = Urgent: Not set
        .... ...1 .... = Acknowledgment: Set
        .... .... 1... = Push: Set
        .... .... .0.. = Reset: Not set
        .... .... ..0. = Syn: Not set
        .... .... ...0 = Fin: Not set
        [TCP Flags: ·······AP···]
    Window: 64240
    [Calculated window size: 64240]
    [Window size scaling factor: -2 (no window scaling used)]
    Checksum: 0x0121 [unverified]
    [Checksum Status: Unverified]
    Urgent Pointer: 0
    [Timestamps]
        [Time since first frame in this TCP stream: 0.038552000 seconds]
        [Time since previous frame in this TCP stream: 0.000118000 seconds]
    [SEQ/ACK analysis]
        [iRTT: 0.037187000 seconds]
        [Bytes in flight: 6]
        [Bytes sent since last PSH flag: 6]
    TCP payload (6 bytes)
Transport Layer Security
    TLSv1.3 Record Layer: Change Cipher Spec Protocol: Change Cipher Spec
        Content Type: Change Cipher Spec (20)
        Version: TLS 1.2 (0x0303)
        Length: 1
        Change Cipher Spec Message

Frame 26: 779 bytes on wire (6232 bits), 779 bytes captured (6232 bits)
    Encapsulation type: Linux cooked-mode capture v2 (210)
    Arrival Time: Nov  8, 2025 04:34:49.534882000 EST
    UTC Arrival Time: Nov  8, 2025 09:34:49.534882000 UTC
    Epoch Arrival Time: 1762594489.534882000
    [Time shift for this packet: 0.000000000 seconds]
    [Time delta from previous captured frame: 0.000056000 seconds]
    [Time delta from previous displayed frame: 0.000056000 seconds]
    [Time since reference or first frame: 100.073003000 seconds]
    Frame Number: 26
    Frame Length: 779 bytes (6232 bits)
    Capture Length: 779 bytes (6232 bits)
    [Frame is marked: False]
    [Frame is ignored: False]
    [Protocols in frame: sll:ethertype:ip:tcp:tls]
Linux cooked capture v2
    Protocol: IPv4 (0x0800)
    Interface index: 2
    Link-layer address type: Ethernet (1)
    Packet type: Sent by us (4)
    Link-layer address length: 6
    Source: VMware_c6:e4:29 (00:0c:29:c6:e4:29)
    Unused: 0000
Internet Protocol Version 4, Src: 192.168.181.128, Dst: 220.181.174.33
    0100 .... = Version: 4
    .... 0101 = Header Length: 20 bytes (5)
    Differentiated Services Field: 0x00 (DSCP: CS0, ECN: Not-ECT)
        0000 00.. = Differentiated Services Codepoint: Default (0)
        .... ..00 = Explicit Congestion Notification: Not ECN-Capable Transport (0)
    Total Length: 759
    Identification: 0x64a7 (25767)
    010. .... = Flags: 0x2, Don't fragment
        0... .... = Reserved bit: Not set
        .1.. .... = Don't fragment: Set
        ..0. .... = More fragments: Not set
    ...0 0000 0000 0000 = Fragment Offset: 0
    Time to Live: 64
    Protocol: TCP (6)
    Header Checksum: 0xd259 [validation disabled]
    [Header checksum status: Unverified]
    Source Address: 192.168.181.128
    Destination Address: 220.181.174.33
    [Stream index: 2]
Transmission Control Protocol, Src Port: 33914, Dst Port: 443, Seq: 1252, Ack: 1, Len: 719
    Source Port: 33914
    Destination Port: 443
    [Stream index: 2]
    [Stream Packet Number: 7]
    [Conversation completeness: Incomplete, DATA (15)]
        ..0. .... = RST: Absent
        ...0 .... = FIN: Absent
        .... 1... = Data: Present
        .... .1.. = ACK: Present
        .... ..1. = SYN-ACK: Present
        .... ...1 = SYN: Present
        [Completeness Flags: ··DASS]
    [TCP Segment Len: 719]
    Sequence Number: 1252    (relative sequence number)
    Sequence Number (raw): 2757993246
    [Next Sequence Number: 1971    (relative sequence number)]
    Acknowledgment Number: 1    (relative ack number)
    Acknowledgment number (raw): 1356947681
    0101 .... = Header Length: 20 bytes (5)
    Flags: 0x018 (PSH, ACK)
        000. .... .... = Reserved: Not set
        ...0 .... .... = Accurate ECN: Not set
        .... 0... .... = Congestion Window Reduced: Not set
        .... .0.. .... = ECN-Echo: Not set
        .... ..0. .... = Urgent: Not set
        .... ...1 .... = Acknowledgment: Set
        .... .... 1... = Push: Set
        .... .... .0.. = Reset: Not set
        .... .... ..0. = Syn: Not set
        .... .... ...0 = Fin: Not set
        [TCP Flags: ·······AP···]
    Window: 64240
    [Calculated window size: 64240]
    [Window size scaling factor: -2 (no window scaling used)]
    Checksum: 0x03ea [unverified]
    [Checksum Status: Unverified]
    Urgent Pointer: 0
    [Timestamps]
        [Time since first frame in this TCP stream: 0.038608000 seconds]
        [Time since previous frame in this TCP stream: 0.000056000 seconds]
    [SEQ/ACK analysis]
        [iRTT: 0.037187000 seconds]
        [Bytes in flight: 725]
        [Bytes sent since last PSH flag: 719]
    TCP payload (719 bytes)
Transport Layer Security
    TLSv1.3 Record Layer: Application Data Protocol: Hypertext Transfer Protocol
        Opaque Type: Application Data (23)
        Version: TLS 1.2 (0x0303)
        Length: 714
        Encrypted Application Data […]: c877edcefe5f06e968487b4663d957e38b2d959cdf13f880c7d041fd3b1db3220bfa07f174929c7df3b1210ae11823818e0173b813a9f8b7d8c70acbfff98df8fce6c1294f7e81e54ea0a12120644a8bec425bb67f9f530cac38f7d1ba1d32d38d0cc41561a38
        [Application Data Protocol: Hypertext Transfer Protocol]

